id,gender,masterCategory,subCategory,articleType,baseColour,season,year,usage,productDisplayName,images
10583,Men,Accessories,Watches,Watches,Gold,Winter,2016,Formal,Esprit Men Nova Genesis Brown Gold Watches,"[""https://res.cloudinary.com/dt6wmon6z/image/upload/v1763729889/10583_khyfrx.jpg""]"
10178,Men,Footwear,Shoes,Casual Shoes,Brown,Fall,2011,Casual,United Colors of Benetton Men Bournie Brown Casual Shoes,"[""https://res.cloudinary.com/dt6wmon6z/image/upload/v1763398450/10178_gb4qec.jpg""]"
10147,Men,Footwear,Shoes,Formal Shoes,Black,Fall,2011,Formal,Rockport Men Ed Plaintoe Black Formal Shoes,"[""https://res.cloudinary.com/dt6wmon6z/image/upload/v1763412879/10147_eyc2lb.jpg""]"
10711,Women,Apparel,Topwear,Tshirts,White,Fall,2011,Casual,Nike Women White Casual T-shirt,"[""https://res.cloudinary.com/dt6wmon6z/image/upload/v1763732580/10711_kb2yul.jpg""]"
10381,Men,Apparel,Topwear,Shirts,Blue,Fall,2011,Formal,United Colors of Benetton Men Solid Blue Shirts,"[""https://res.cloudinary.com/dt6wmon6z/image/upload/v1763401074/10381_e0hjzp.jpg""]"
10729,Women,Accessories,Bags,Handbags,Black,Winter,2015,Casual,Murcia Women Lorra Black Black Handbags,"[""https://res.cloudinary.com/dt6wmon6z/image/upload/v1763734057/10729_czdvoj.jpg""]"
10988,Women,Apparel,Topwear,Tshirts,Pink,Fall,2011,Casual,Inkfruit Women Flying Advantures Pink Tshirts,"[""https://res.cloudinary.com/dt6wmon6z/image/upload/v1763737560/10988_f4jvqm.jpg""]"
10386,Women,Accessories,Watches,Watches,White,Winter,2016,Casual,Puma Women Vitality Gold Stones  169 White Watches,"[""https://res.cloudinary.com/dt6wmon6z/image/upload/v1763401083/10386_v1ll2y.jpg""]"
10716,Women,Apparel,Innerwear,Bra,White,Fall,2011,Sports,Nike Women Training Sports Bra,"[""https://res.cloudinary.com/dt6wmon6z/image/upload/v1763732586/10716_dx581m.jpg""]"
10140,Women,Accessories,Watches,Watches,Silver,Winter,2016,Casual,Esprit Women Rocks Houston Black Silver Watches,"[""https://res.cloudinary.com/dt6wmon6z/image/upload/v1763412878/10140_q2x6im.jpg""]"
10372,Men,Apparel,Topwear,Tshirts,Beige,Fall,2011,Casual,United Colors of Benetton Men Printed Beige Tshirts,"[""https://res.cloudinary.com/dt6wmon6z/image/upload/v1763401060/10372_dip6uc.jpg""]"
10149,Men,Footwear,Shoes,Formal Shoes,Brown,Fall,2011,Formal,Rockport Men Ed Plaintoe Brown Formal Shoes,"[""https://res.cloudinary.com/dt6wmon6z/image/upload/v1763507898/10149_j2hozp.jpg""]"
10182,Women,Footwear,Shoes,Casual Shoes,White,Fall,2011,Casual,Puma Women Style Cat White Casual Shoes,"[""https://res.cloudinary.com/dt6wmon6z/image/upload/v1763398514/10182_bte3p7.jpg""]"
10176,Men,Footwear,Shoes,Casual Shoes,Black,Fall,2011,Casual,United Colors of Benetton Men Cloud 9 Black Casual Shoes,"[""https://res.cloudinary.com/dt6wmon6z/image/upload/v1763398447/10176_ulgd03.jpg""]"
10344,Men,Apparel,Topwear,Tshirts,Purple,Fall,2011,Casual,United Colors of Benetton Men Solid Purple Tshirts,"[""https://res.cloudinary.com/dt6wmon6z/image/upload/v1763727513/10344_yzfupt.jpg""]"
10720,Men,Apparel,Bottomwear,Shorts,White,Summer,2011,Sports,Nike Men Ftbll/Socc shorts White Shorts,"[""https://res.cloudinary.com/dt6wmon6z/image/upload/v1763734216/10720_ayaw9a.jpg""]"
10512,Women,Apparel,Topwear,Tops,Blue,Fall,2011,Casual,Flying Machine Women RN HS Blue Tshirts,"[""https://res.cloudinary.com/dt6wmon6z/image/upload/v1763729856/10512_jpvndd.jpg""]"
10718,Women,Apparel,Topwear,Tops,Orange,Fall,2011,Sports,Nike Women Trainng sports bra Orange Tops,"[""https://res.cloudinary.com/dt6wmon6z/image/upload/v1763734211/10718_vylzpm.jpg""]"
10388,Women,Accessories,Watches,Watches,Pink,Winter,2016,Casual,Puma Women Pliancy 199 Pink Watches,"[""https://res.cloudinary.com/dt6wmon6z/image/upload/v1763401086/10388_ohexnl.jpg""]"
10727,Women,Accessories,Bags,Handbags,Brown,Winter,2015,Casual,Murcia Women Dusvatar Brown Brown Handbags,"[""https://res.cloudinary.com/dt6wmon6z/image/upload/v1763734225/10727_kv2wkk.jpg""]"
10343,Women,Apparel,Topwear,Tshirts,Blue,Fall,2011,Casual,United Colors of Benetton Women Solid Blue Tshirts,"[""https://res.cloudinary.com/dt6wmon6z/image/upload/v1763727512/10343_i8jhkb.jpg""]"
10171,Men,Footwear,Shoes,Formal Shoes,Brown,Fall,2011,Formal,United Colors of Benetton Men vertigo Brown Shoes,"[""https://res.cloudinary.com/dt6wmon6z/image/upload/v1763398440/10171_ycs7iv.jpg""]"
10185,Men,Apparel,Topwear,Shirts,White,Fall,2011,Casual,Indigo Nation Men Price catch White Shirts,"[""https://res.cloudinary.com/dt6wmon6z/image/upload/v1763398522/10185_ku3joi.jpg""]"
10153,Men,Footwear,Shoes,Formal Shoes,Brown,Fall,2011,Formal,Rockport Men Drsp SLip On Brown Formal Shoes,"[""https://res.cloudinary.com/dt6wmon6z/image/upload/v1763398427/10153_zwt3vo.jpg""]"
10361,Men,Apparel,Topwear,Tshirts,Purple,Fall,2011,Casual,United Colors of Benetton Men Graphic Printed Purple Tshirts,"[""https://res.cloudinary.com/dt6wmon6z/image/upload/v1763401152/10361_ghkxuf.jpg""]"
10705,Women,Accessories,Watches,Watches,Silver,Winter,2016,Casual,Esprit Women Twist Black Houston Silver Watches,"[""https://res.cloudinary.com/dt6wmon6z/image/upload/v1763732574/10705_htuh2h.jpg""]"
10395,Men,Accessories,Watches,Watches,Red,Winter,2016,Sports,Puma Men Cardiac II Red Watches,"[""https://res.cloudinary.com/dt6wmon6z/image/upload/v1763401097/10395_umpfl3.jpg""]"
10508,Women,Apparel,Topwear,Tops,Black,Fall,2011,Casual,Flying Machine Women RN SL Black Top,"[""https://res.cloudinary.com/dt6wmon6z/image/upload/v1763729924/10508_daz9yf.jpg""]"
10198,Women,Accessories,Bags,Handbags,Beige,Winter,2015,Casual,Murcia Women Hddcs Beige Handbags,"[""https://res.cloudinary.com/dt6wmon6z/image/upload/v1763398550/10198_era3p8.jpg""]"
10392,Women,Accessories,Watches,Watches,White,Winter,2016,Casual,Puma Women Pure Pliancy 258 White Watches,"[""https://res.cloudinary.com/dt6wmon6z/image/upload/v1763401092/10392_hs9zvl.jpg""]"
10702,Women,Accessories,Watches,Watches,Steel,Winter,2016,Casual,Esprit Women Lissomy Glam Silver Black Steel Watches,"[""https://res.cloudinary.com/dt6wmon6z/image/upload/v1763732569/10702_usgjnh.jpg""]"
10366,Women,Apparel,Bottomwear,Skirts,Black,Fall,2011,Casual,United Colors of Benetton Women Solid Black Skirt,"[""https://res.cloudinary.com/dt6wmon6z/image/upload/v1763401051/10366_qnh3oy.jpg""]"
10154,Men,Footwear,Shoes,Casual Shoes,Brown,Fall,2011,Casual,Rockport Men Bal Brown Casual Shoes,"[""https://res.cloudinary.com/dt6wmon6z/image/upload/v1763398427/10154_ygtbpt.jpg""]"
10359,Men,Apparel,Topwear,Tshirts,White,Fall,2011,Casual,United Colors of Benetton Men Printed White Tshirts,"[""https://res.cloudinary.com/dt6wmon6z/image/upload/v1763401147/10359_ljhj0m.jpg""]"
10196,Women,Accessories,Bags,Handbags,Green,Winter,2015,Casual,Murcia Women Hddcs Green Handbags,"[""https://res.cloudinary.com/dt6wmon6z/image/upload/v1763398549/10196_dgqvae.jpg""]"
10350,Women,Apparel,Topwear,Tshirts,Purple,Fall,2011,Casual,United Colors of Benetton Women Applique Work Purple T-shirt,"[""https://res.cloudinary.com/dt6wmon6z/image/upload/v1763727513/10350_k28bs3.jpg""]"
10162,Men,Footwear,Shoes,Casual Shoes,White,Fall,2011,Casual,Puma Men 917 Lo Paint Splatter White Casual Shoes,"[""https://res.cloudinary.com/dt6wmon6z/image/upload/v1763398435/10162_yxji6j.jpg""]"
10506,Women,Apparel,Topwear,Tops,Red,Fall,2011,Casual,Flying Machine Women Fuschia Red Tshirts,"[""https://res.cloudinary.com/dt6wmon6z/image/upload/v1763729923/10506_w5mavl.jpg""]"
10734,Women,Accessories,Bags,Handbags,Green,Winter,2015,Casual,Murcia Women Mcc Green Green Handbags,"[""https://res.cloudinary.com/dt6wmon6z/image/upload/v1763734058/10734_yjdtwg.jpg""]"
10995,Men,Apparel,Topwear,Tshirts,Black,Fall,2011,Casual,Inkfruit Men Respest Me Black Tshirts,"[""https://res.cloudinary.com/dt6wmon6z/image/upload/v1763737569/10995_kxryut.jpg""]"
10733,Women,Accessories,Bags,Handbags,Purple,Winter,2015,Casual,Murcia Women Mcc Purple Purple Handbags,"[""https://res.cloudinary.com/dt6wmon6z/image/upload/v1763734059/10733_sxxabp.jpg""]"
10501,Women,Apparel,Topwear,Tshirts,White,Fall,2011,Casual,Flying Machine Women RN HS White T-shirt,"[""https://res.cloudinary.com/dt6wmon6z/image/upload/v1763729916/10501_nm5txm.jpg""]"
10357,Men,Apparel,Topwear,Tshirts,Maroon,Fall,2011,Casual,United Colors of Benetton Men Maroon Polo Tshirt,"[""https://res.cloudinary.com/dt6wmon6z/image/upload/v1763401146/10357_ahpvqv.jpg""]"
10992,Men,Apparel,Topwear,Tshirts,Purple,Fall,2011,Casual,Inkfruit Men Dust Rider Purple Tshirts,"[""https://res.cloudinary.com/dt6wmon6z/image/upload/v1763737567/10992_fjh8hi.jpg""]"
10758,Girls,Footwear,Shoes,Casual Shoes,Blue,Winter,2012,Kids,Disney Kids Girls Princess Heart Blue Casual Shoes,"[""https://res.cloudinary.com/dt6wmon6z/image/upload/v1763734090/10758_ozemri.jpg""]"
10767,Unisex,Footwear,Flip Flops,Flip Flops,White,Winter,2012,Kids,Disney Unisex Kids Basic White Flip Flops,"[""https://res.cloudinary.com/dt6wmon6z/image/upload/v1763734104/10767_ydywl8.jpg""]"
10303,Men,Footwear,Shoes,Sandals,Brown,Summer,2016,Casual,Clarks Men Brown Leather Sandals,"[""https://res.cloudinary.com/dt6wmon6z/image/upload/v1763727514/10303_fp5kj8.jpg""]"
10131,Women,Accessories,Watches,Watches,Steel,Winter,2016,Casual,Esprit Women Romain Brown Steel Watches,"[""https://res.cloudinary.com/dt6wmon6z/image/upload/v1763412876/10131_ebed8k.jpg""]"
10793,Men,Apparel,Topwear,Shirts,Red,Fall,2011,Casual,Wrangler Men Authentic Rope Embro Red Shirts,"[""https://res.cloudinary.com/dt6wmon6z/image/upload/v1763734136/10793_ykxp6z.jpg""]"
10599,Unisex,Accessories,Headwear,Caps,White,Fall,2011,Sports,Nike Unisex Tennis White Caps,"[""https://res.cloudinary.com/dt6wmon6z/image/upload/v1763729903/10599_bgjzec.jpg""]"
10109,Women,Accessories,Watches,Watches,Steel,Winter,2016,Casual,Fastrack Women Denim Analogue Steel Watch,"[""https://res.cloudinary.com/dt6wmon6z/image/upload/v1763507897/10109_aopuaj.jpg""]"
10794,Men,Apparel,Topwear,Shirts,Navy Blue,Fall,2011,Casual,Wrangler Men Warnick Square Block Navy Blue Shirts,"[""https://res.cloudinary.com/dt6wmon6z/image/upload/v1763734136/10794_fj4q58.jpg""]"
10136,Women,Accessories,Watches,Watches,Steel,Winter,2016,Casual,Esprit Women Pure Vitality Black Steel Watches,"[""https://res.cloudinary.com/dt6wmon6z/image/upload/v1763507903/10136_bpn8m5.jpg""]"
10304,Men,Footwear,Sandal,Sandals,Black,Fall,2011,Casual,Clarks Men Vieri Deck Leather Black Sandals,"[""https://res.cloudinary.com/dt6wmon6z/image/upload/v1763727514/10304_jl9qer.jpg""]"
10760,Unisex,Footwear,Flip Flops,Flip Flops,Red,Winter,2012,Kids,Disney Unisex Kids Basic Red Flip Flops,"[""https://res.cloudinary.com/dt6wmon6z/image/upload/v1763734092/10760_x4ki3s.jpg""]"
10769,Unisex,Footwear,Flip Flops,Flip Flops,White,Winter,2012,Kids,Disney Unisex Kids Basic White Flip Flops,"[""https://res.cloudinary.com/dt6wmon6z/image/upload/v1763734107/10769_hlky81.jpg""]"
10756,Girls,Footwear,Shoes,Casual Shoes,Red,Winter,2012,Kids,Disney Kids Welding Red Casual Shoes,"[""https://res.cloudinary.com/dt6wmon6z/image/upload/v1763734087/10756_h99a4h.jpg""]"
10564,Men,Apparel,Topwear,Tshirts,White,Fall,2011,Casual,Puma Men Large Logo Ringer White Tshirts,"[""https://res.cloudinary.com/dt6wmon6z/image/upload/v1763729857/10564_mvbgnz.jpg""]"
10332,Men,Accessories,Belts,Belts,Brown,Fall,2011,Casual,Indigo Nation Men cataclasite Brown Belts,"[""https://res.cloudinary.com/dt6wmon6z/image/upload/v1763727512/10332_nur4kd.jpg""]"
10138,Women,Accessories,Watches,Watches,Silver,Winter,2016,Casual,Esprit Women Spark Pink Silver Watches,"[""https://res.cloudinary.com/dt6wmon6z/image/upload/v1763508621/10138_dt2ceh.jpg""]"
10335,Women,Apparel,Topwear,Tops,Pink,Fall,2011,Casual,United Colors of Benetton Women Striped Magenta Top,"[""https://res.cloudinary.com/dt6wmon6z/image/upload/v1763727509/10335_mmncid.jpg""]"
10107,Men,Accessories,Watches,Watches,Steel,Winter,2016,Casual,Fastrack Men Analogue Leather Steel Watches,"[""https://res.cloudinary.com/dt6wmon6z/image/upload/v1763412873/10107_a90wzp.jpg""]"
10563,Men,Apparel,Topwear,Tshirts,Black,Fall,2011,Casual,Puma Men Large Logo Ringer Black Tshirts,"[""https://res.cloudinary.com/dt6wmon6z/image/upload/v1763729857/10563_shzwmo.jpg""]"
10751,Men,Apparel,Bottomwear,Track Pants,Grey,Fall,2011,Sports,Nike Men Breakline Grey Track Pants,"[""https://res.cloudinary.com/dt6wmon6z/image/upload/v1763734082/10751_pkjiol.jpg""]"
10597,Men,Apparel,Bottomwear,Jeans,Blue,Fall,2011,Casual,Flying Machine Men Skinny Jack Blue Jeans,"[""https://res.cloudinary.com/dt6wmon6z/image/upload/v1763729902/10597_ruxy83.jpg""]"
10190,Men,Apparel,Topwear,Shirts,White,Fall,2011,Casual,Indigo Nation Men Club Poplin White Shirts,"[""https://res.cloudinary.com/dt6wmon6z/image/upload/v1763398537/10190_kszpge.jpg""]"
10500,Women,Apparel,Dress,Dresses,Navy Blue,Fall,2011,Casual,Flying Machine Women OS Blue Tops,"[""https://res.cloudinary.com/dt6wmon6z/image/upload/v1763402657/10500_axemed.jpg""]"
10732,Women,Accessories,Bags,Handbags,Red,Winter,2015,Casual,Murcia Women Lorra Red Red Handbags,"[""https://res.cloudinary.com/dt6wmon6z/image/upload/v1763734058/10732_cvo1xm.jpg""]"
10356,Men,Apparel,Topwear,Shirts,Blue,Fall,2011,Casual,United Colors of Benetton Men Solid Blue Shirts,"[""https://res.cloudinary.com/dt6wmon6z/image/upload/v1763401142/10356_iptft9.jpg""]"
10164,Men,Accessories,Watches,Watches,Green,Winter,2016,Casual,Carrera Men Green strap witrh green dial Green Watches,"[""https://res.cloudinary.com/dt6wmon6z/image/upload/v1763398435/10164_kuoxox.jpg""]"
10993,Men,Apparel,Topwear,Tshirts,Grey,Fall,2011,Casual,Inkfruit Men Tea Kwon Do Grey Tshirts,"[""https://res.cloudinary.com/dt6wmon6z/image/upload/v1763737568/10993_vq3qqm.jpg""]"
10369,Men,Apparel,Topwear,Shirts,Blue,Fall,2011,Casual,United Colors of Benetton Men Checks Blue Shirts,"[""https://res.cloudinary.com/dt6wmon6z/image/upload/v1763401051/10369_jmnwri.jpg""]"
10351,Women,Apparel,Bottomwear,Skirts,Grey,Fall,2011,Casual,United Colors of Benetton Women Check Skirt Grey Skirts,"[""https://res.cloudinary.com/dt6wmon6z/image/upload/v1763401136/10351_q8iw6e.jpg""]"
10735,Women,Accessories,Bags,Handbags,Black,Winter,2015,Casual,Murcia Women Mcc Black Black Handbags,"[""https://res.cloudinary.com/dt6wmon6z/image/upload/v1763734059/10735_xabbd7.jpg""]"
10507,Women,Apparel,Topwear,Tshirts,Pink,Fall,2011,Casual,Flying Machine Women Pink Polo Tshirts,"[""https://res.cloudinary.com/dt6wmon6z/image/upload/v1763729923/10507_czxcva.jpg""]"
10197,Women,Accessories,Bags,Handbags,Brown,Winter,2015,Casual,Murcia Women Hddcs Brown Handbags,"[""https://res.cloudinary.com/dt6wmon6z/image/upload/v1763398549/10197_fogonq.jpg""]"
10994,Men,Apparel,Topwear,Tshirts,Black,Fall,2011,Casual,Inkfruit Men Near Future Black Tshirts,"[""https://res.cloudinary.com/dt6wmon6z/image/upload/v1763737568/10994_bnbwpe.jpg""]"
10155,Men,Footwear,Shoes,Casual Shoes,Brown,Fall,2011,Casual,Rockport Men Tr Bal Brown Casual Shoes,"[""https://res.cloudinary.com/dt6wmon6z/image/upload/v1763398428/10155_jyhfab.jpg""]"
10367,Men,Apparel,Topwear,Shirts,Purple,Fall,2011,Casual,United Colors of Benetton Men Checks Purple Shirts,"[""https://res.cloudinary.com/dt6wmon6z/image/upload/v1763401051/10367_z7hsil.jpg""]"
10393,Women,Accessories,Watches,Watches,Black,Winter,2016,Casual,Puma Women Spark 351 Black Watches,"[""https://res.cloudinary.com/dt6wmon6z/image/upload/v1763401095/10393_krtkyl.jpg""]"
10358,Men,Apparel,Topwear,Tshirts,Blue,Fall,2011,Casual,United Colors of Benetton Men Solid Polo Blue Tshirts,"[""https://res.cloudinary.com/dt6wmon6z/image/upload/v1763401147/10358_l7fwfz.jpg""]"
10394,Men,Accessories,Watches,Watches,Red,Winter,2016,Sports,Puma Men Cardiac Red Watches,"[""https://res.cloudinary.com/dt6wmon6z/image/upload/v1763401097/10394_gi3tqe.jpg""]"
10360,Women,Apparel,Dress,Dresses,Black,Fall,2011,Casual,United Colors of Benetton Women Black Dress,"[""https://res.cloudinary.com/dt6wmon6z/image/upload/v1763401152/10360_qxx44e.jpg""]"
10152,Men,Footwear,Shoes,Casual Shoes,Black,Fall,2011,Casual,Rockport Men TR Bal Black Casual Shoes,"[""https://res.cloudinary.com/dt6wmon6z/image/upload/v1763398427/10152_cqsju4.jpg""]"
10704,Women,Accessories,Watches,Watches,Steel,Winter,2016,Casual,Esprit Women Organic Pretty Black Houston Steel Watches,"[""https://res.cloudinary.com/dt6wmon6z/image/upload/v1763732572/10704_gvfiif.jpg""]"
10199,Women,Accessories,Bags,Handbags,Black,Winter,2015,Casual,Murcia Women Emma Black Handbags,"[""https://res.cloudinary.com/dt6wmon6z/image/upload/v1763398550/10199_imhhlg.jpg""]"
10509,Women,Apparel,Topwear,Tshirts,White,Fall,2011,Casual,Flying Machine Women RN HS White Tshirts,"[""https://res.cloudinary.com/dt6wmon6z/image/upload/v1763729925/10509_d2eotw.jpg""]"
10139,Women,Accessories,Watches,Watches,Steel,Winter,2016,Casual,Esprit Women Cool Chic Night Steel Watch,"[""https://res.cloudinary.com/dt6wmon6z/image/upload/v1763507902/10139_brggy0.jpg""]"
10596,Women,Accessories,Watches,Watches,Green,Winter,2016,Casual,Esprit Women Houston Funky Green Green Watch,"[""https://res.cloudinary.com/dt6wmon6z/image/upload/v1763729897/10596_erafwi.jpg""]"
10106,Women,Accessories,Watches,Watches,Steel,Winter,2016,Casual,Fastrack Women Essentials Steel Watches,"[""https://res.cloudinary.com/dt6wmon6z/image/upload/v1763412873/10106_zrdp0h.jpg""]"
10334,Men,Accessories,Belts,Belts,Black,Fall,2011,Casual,Indigo Nation Men diorite Black Belts,"[""https://res.cloudinary.com/dt6wmon6z/image/upload/v1763727510/10334_jprpgx.jpg""]"
10750,Men,Apparel,Topwear,Tshirts,Blue,Fall,2011,Sports,Nike Men Remix Crew Blue Tshirts,"[""https://res.cloudinary.com/dt6wmon6z/image/upload/v1763734081/10750_kbge9p.jpg""]"
10768,Unisex,Footwear,Flip Flops,Flip Flops,Pink,Winter,2012,Kids,Disney Unisex Kids Basic Pink Flip Flops,"[""https://res.cloudinary.com/dt6wmon6z/image/upload/v1763734105/10768_eaizmf.jpg""]"
10565,Men,Apparel,Topwear,Tshirts,Black,Fall,2011,Casual,Puma Men Heritage Black Polo Tshirts,"[""https://res.cloudinary.com/dt6wmon6z/image/upload/v1763729857/10565_mxbkwc.jpg""]"
10757,Unisex,Footwear,Flip Flops,Flip Flops,Pink,Winter,2012,Kids,Disney Unisex Kids Princess Heart Pink Flip Flops,"[""https://res.cloudinary.com/dt6wmon6z/image/upload/v1763734088/10757_bjxr8r.jpg""]"
10333,Men,Accessories,Belts,Belts,Brown,Fall,2011,Casual,Indigo Nation Men chert Brown Belts,"[""https://res.cloudinary.com/dt6wmon6z/image/upload/v1763727513/10333_xr7r8f.jpg""]"
10101,Men,Footwear,Shoes,Sports Shoes,Black,Fall,2011,Sports,Reebok Men Island Explorer Black Sports Shoes,"[""https://res.cloudinary.com/dt6wmon6z/image/upload/v1763395628/10101_cjwiqp.jpg""]"
10108,Women,Accessories,Watches,Watches,Steel,Winter,2016,Casual,Fastrack Women Denim Analogue Steel Watches,"[""https://res.cloudinary.com/dt6wmon6z/image/upload/v1763507900/10108_gdnful.jpg""]"
10598,Women,Apparel,Topwear,Shirts,Blue,Fall,2011,Casual,Flying Machine Women HS Blue Denim Shirt,"[""https://res.cloudinary.com/dt6wmon6z/image/upload/v1763729903/10598_fcrorg.jpg""]"
10305,Men,Footwear,Shoes,Casual Shoes,Black,Fall,2011,Casual,Clarks Men Rocco Fuse Brown Casual Shoes,"[""https://res.cloudinary.com/dt6wmon6z/image/upload/v1763727514/10305_ikjxds.jpg""]"
10137,Women,Accessories,Watches,Watches,Steel,Winter,2016,Casual,Esprit Women Lissomy Brown Steel Watches,"[""https://res.cloudinary.com/dt6wmon6z/image/upload/v1763412877/10137_krhf70.jpg""]"
10761,Unisex,Footwear,Flip Flops,Flip Flops,Red,Winter,2012,Kids,Disney Unisex Kids Basic Red Flip Flops,"[""https://res.cloudinary.com/dt6wmon6z/image/upload/v1763734096/10761_kreneq.jpg""]"
10795,Men,Apparel,Topwear,Shirts,Navy Blue,Fall,2011,Casual,Wrangler Men Warnick Square Block Navy Blue Shirts,"[""https://res.cloudinary.com/dt6wmon6z/image/upload/v1763734137/10795_rvpeei.jpg""]"
10759,Unisex,Footwear,Flip Flops,Flip Flops,Pink,Winter,2012,Kids,Disney Unisex Kids Mini Mouse Pink Flip Flops,"[""https://res.cloudinary.com/dt6wmon6z/image/upload/v1763734091/10759_l7f4fw.jpg""]"
10792,Men,Apparel,Topwear,Shirts,Red,Fall,2011,Casual,Wrangler Men Authentic Rope Embro Red Shirts,"[""https://res.cloudinary.com/dt6wmon6z/image/upload/v1763734135/10792_m4vnvb.jpg""]"
10766,Unisex,Footwear,Flip Flops,Flip Flops,Yellow,Winter,2012,Kids,Disney Unisex Kids Basic Yellow Flip Flops,"[""https://res.cloudinary.com/dt6wmon6z/image/upload/v1763734104/10766_eeq2rr.jpg""]"
10130,Women,Accessories,Watches,Watches,Steel,Winter,2016,Casual,Esprit Women Pure E-Ffect Black Steel Watches,"[""https://res.cloudinary.com/dt6wmon6z/image/upload/v1763412876/10130_es7lki.jpg""]"
10302,Men,Footwear,Shoes,Formal Shoes,Brown,Spring,2012,Formal,Clarks Men Leather Brown Formal Shoes,"[""https://res.cloudinary.com/dt6wmon6z/image/upload/v1763727514/10302_mwjqld.jpg""]"
10042,Women,Apparel,Topwear,Tshirts,Pink,Fall,2011,Sports,Nike Women Pink Polo Tshirts,"[""https://res.cloudinary.com/dt6wmon6z/image/upload/v1763412368/10042_mxnved.jpg""]"
10270,Women,Footwear,Shoes,Flats,Silver,Fall,2012,Casual,Clarks Women Shona Fringe Leather Silver Flats,"[""https://res.cloudinary.com/dt6wmon6z/image/upload/v1763400089/10270_a3b0xi.jpg""]"
10426,Men,Apparel,Topwear,Tshirts,Black,Fall,2011,Casual,United Colors of Benetton Men Polo Black Tshirts,"[""https://res.cloudinary.com/dt6wmon6z/image/upload/v1763728628/10426_ho0nyk.jpg""]"
10284,Women,Footwear,Shoes,Flats,White,Fall,2012,Casual,Clarks Women Leather White Flats,"[""https://res.cloudinary.com/dt6wmon6z/image/upload/v1763400039/10284_acigzr.jpg""]"
10089,Women,Footwear,Shoes,Sports Shoes,Silver,Fall,2011,Sports,Reebok Women Raceon Silver Sports Shoes,"[""https://res.cloudinary.com/dt6wmon6z/image/upload/v1763395621/10089_qyouz5.jpg""]"
10283,Men,Footwear,Sandal,Sandals,Black,Fall,2012,Casual,Clarks Men Unstructured Leather Black Sandals,"[""https://res.cloudinary.com/dt6wmon6z/image/upload/v1763400038/10283_ycbnnm.jpg""]"
10421,Men,Apparel,Topwear,Shirts,Blue,Fall,2011,Casual,United Colors of Benetton Men Solid Blue Shirts,"[""https://res.cloudinary.com/dt6wmon6z/image/upload/v1763728627/10421_kaijdh.jpg""]"
10613,Women,Footwear,Shoes,Casual Shoes,White,Spring,2013,Casual,Carlton London Women Casual White Casual Shoes,"[""https://res.cloudinary.com/dt6wmon6z/image/upload/v1763732489/10613_djiwzs.jpg""]"
10277,Men,Footwear,Shoes,Formal Shoes,Black,Spring,2012,Smart Casual,Clarks Men Black Leather Semiformal Shoes,"[""https://res.cloudinary.com/dt6wmon6z/image/upload/v1763400036/10277_hp5p88.jpg""]"
10879,Men,Apparel,Topwear,Tshirts,Grey,Fall,2011,Casual,Wrangler Men Grey T-shirt,"[""https://res.cloudinary.com/dt6wmon6z/image/upload/v1763737548/10879_ctnrrb.jpg""]"
10045,Men,Apparel,Topwear,Tshirts,Blue,Fall,2011,Casual,Puma Men Heroes Party Graphic Blue Tshirts,"[""https://res.cloudinary.com/dt6wmon6z/image/upload/v1763412401/10045_j8c4uj.jpg""]"
10846,Men,Apparel,Topwear,Tshirts,Blue,Fall,2011,Casual,Wrangler Men Falcon Print Blue T-Shirts,"[""https://res.cloudinary.com/dt6wmon6z/image/upload/v1763737580/10846_sx4hmo.jpg""]"
10248,Women,Accessories,Bags,Handbags,Brown,Winter,2015,Casual,Murcia Women Asjke Coffee Brown Handbags,"[""https://res.cloudinary.com/dt6wmon6z/image/upload/v1763509100/10248_ji3qb2.jpg""]"
10241,Men,Accessories,Watches,Watches,Black,Winter,2016,Casual,Esprit Men Momentum Black Black Watches,"[""https://res.cloudinary.com/dt6wmon6z/image/upload/v1763509087/10241_ta43pz.jpg""]"
10073,Women,Apparel,Topwear,Tshirts,Purple,Fall,2011,Casual,Puma Women cat line tee Purple Tshirts,"[""https://res.cloudinary.com/dt6wmon6z/image/upload/v1763395608/10073_icfn6r.jpg""]"
10884,Men,Apparel,Topwear,Tshirts,Grey,Fall,2011,Casual,Wrangler Men Grey Glow In Dark T-shirt,"[""https://res.cloudinary.com/dt6wmon6z/image/upload/v1763737553/10884_vnpyqb.jpg""]"
10428,Women,Apparel,Topwear,Tops,Black,Fall,2011,Casual,United Colors of Benetton Women Solid Black Tops,"[""https://res.cloudinary.com/dt6wmon6z/image/upload/v1763728628/10428_rlkhel.jpg""]"
10870,Men,Apparel,Topwear,Tshirts,Blue,Fall,2011,Casual,Wrangler Men Fly The Wind Blue T-Shirts,"[""https://res.cloudinary.com/dt6wmon6z/image/upload/v1763737610/10870_uqftes.jpg""]"
10622,Women,Footwear,Flip Flops,Flip Flops,Green,Fall,2011,Casual,Carlton London Women Casual Green Slippers,"[""https://res.cloudinary.com/dt6wmon6z/image/upload/v1763732496/10622_rajzcz.jpg""]"
10410,Men,Apparel,Topwear,Tshirts,White,Fall,2011,Casual,United Colors of Benetton Men Solid White Tshirts,"[""https://res.cloudinary.com/dt6wmon6z/image/upload/v1763728959/10410_k8pou3.jpg""]"
10848,Men,Apparel,Topwear,Tshirts,Blue,Fall,2011,Casual,Wrangler Men Blue T-shirt,"[""https://res.cloudinary.com/dt6wmon6z/image/upload/v1763737580/10848_rbime7.jpg""]"
10074,Men,Apparel,Topwear,Tshirts,Black,Fall,2011,Casual,Puma Men Puma runhard tee Black Tshirts,"[""https://res.cloudinary.com/dt6wmon6z/image/upload/v1763395608/10074_tzjrot.jpg""]"
10246,Women,Accessories,Bags,Handbags,Brown,Winter,2015,Casual,Murcia Women Zoe Brown Handbags,"[""https://res.cloudinary.com/dt6wmon6z/image/upload/v1763509095/10246_ch31i8.jpg""]"
10080,Men,Footwear,Shoes,Sports Shoes,Black,Fall,2011,Sports,Reebok Men Run Sheer Black Sports Shoes,"[""https://res.cloudinary.com/dt6wmon6z/image/upload/v1763395614/10080_kbe7jv.jpg""]"
10279,Men,Footwear,Shoes,Casual Shoes,Black,Fall,2012,Casual,Clarks Men Nature Easy Leather Black Casual Shoes,"[""https://res.cloudinary.com/dt6wmon6z/image/upload/v1763400038/10279_sracus.jpg""]"
10877,Men,Apparel,Topwear,Tshirts,Navy Blue,Fall,2011,Casual,Wrangler Men Navy Blue Polo Tshirts,"[""https://res.cloudinary.com/dt6wmon6z/image/upload/v1763737544/10877_cov0pd.jpg""]"
10883,Men,Apparel,Topwear,Tshirts,Beige,Fall,2011,Casual,Wrangler Men American Photo Print Beige T-shirt,"[""https://res.cloudinary.com/dt6wmon6z/image/upload/v1763737552/10883_gaqvwq.jpg""]"
10823,Men,Apparel,Topwear,Tshirts,Grey,Fall,2011,Casual,Wrangler Men Grey Polo Tshirts,"[""https://res.cloudinary.com/dt6wmon6z/image/upload/v1763734179/10823_ibndtc.jpg""]"
