id,gender,masterCategory,subCategory,articleType,baseColour,season,year,usage,productDisplayName,images
10776,Men,Apparel,Topwear,Tshirts,Red,Summer,2011,Sports,Nike Men Athletic Red Tshirts,"[""https://res.cloudinary.com/dt6wmon6z/image/upload/v1763734117/10776_ijuepq.jpg""]"
10749,Unisex,Footwear,Flip Flops,Flip Flops,Red,Winter,2012,Kids,Disney Unisex Kids Mickey Star Red Flip Flops,"[""https://res.cloudinary.com/dt6wmon6z/image/upload/v1763734079/10749_aax6zd.jpg""]"
10188,Men,Apparel,Topwear,Shirts,Blue,Fall,2011,Casual,Indigo Nation Men   Blue & White Stripe Shirt,"[""https://res.cloudinary.com/dt6wmon6z/image/upload/v1763398529/10188_r0ahnu.jpg""]"
10385,Women,Accessories,Watches,Watches,White,Winter,2016,Casual,Puma Women Vitality Stones 168 White Watches,"[""https://res.cloudinary.com/dt6wmon6z/image/upload/v1763401081/10385_qctdl7.jpg""]"
10715,Women,Apparel,Topwear,Tops,Black,Fall,2011,Casual,Nike Women Training sports bra Black Tops,"[""https://res.cloudinary.com/dt6wmon6z/image/upload/v1763732585/10715_nemipd.jpg""]"
10371,Men,Apparel,Topwear,Sweatshirts,Black,Fall,2011,Casual,United Colors of Benetton Men Printed Black Sweatshirt,"[""https://res.cloudinary.com/dt6wmon6z/image/upload/v1763401060/10371_dpcrfh.jpg""]"
10143,Men,Footwear,Shoes,Formal Shoes,Brown,Fall,2011,Formal,Rockport Men Moc Front Brown Formal Shoes,"[""https://res.cloudinary.com/dt6wmon6z/image/upload/v1763507897/10143_fp6c7u.jpg""]"
10144,Men,Footwear,Shoes,Casual Shoes,Brown,Fall,2011,Casual,Rockport Men Drsp Wingtip Brown Casual Shoes,"[""https://res.cloudinary.com/dt6wmon6z/image/upload/v1763507897/10144_pmqtwj.jpg""]"
10376,Men,Apparel,Topwear,Tshirts,Blue,Fall,2011,Casual,United Colors of Benetton Men Printed Blue Tshirts,"[""https://res.cloudinary.com/dt6wmon6z/image/upload/v1763401066/10376_lrd89m.jpg""]"
10712,Women,Apparel,Topwear,Tshirts,Blue,Fall,2011,Casual,Nike Women Casual short sleeve tshirt Blue Tshirts,"[""https://res.cloudinary.com/dt6wmon6z/image/upload/v1763732581/10712_wjobvp.jpg""]"
10382,Women,Apparel,Topwear,Tops,Grey,Fall,2011,Casual,United Colors of Benetton Women Grey Top,"[""https://res.cloudinary.com/dt6wmon6z/image/upload/v1763401076/10382_nsquig.jpg""]"
10724,Women,Accessories,Bags,Handbags,Black,Winter,2015,Casual,Murcia Women Black Black Handbags,"[""https://res.cloudinary.com/dt6wmon6z/image/upload/v1763734223/10724_cqwrh8.jpg""]"
10172,Men,Footwear,Shoes,Casual Shoes,Grey,Fall,2011,Casual,United Colors of Benetton Men Iceland Grey Casual Shoes,"[""https://res.cloudinary.com/dt6wmon6z/image/upload/v1763398445/10172_zaew23.jpg""]"
10340,Women,Apparel,Topwear,Tshirts,Green,Fall,2011,Casual,United Colors of Benetton Women Green Polo T-shirt,"[""https://res.cloudinary.com/dt6wmon6z/image/upload/v1763727511/10340_xuattv.jpg""]"
10186,Men,Apparel,Topwear,Shirts,Black,Fall,2011,Casual,Indigo Nation Men Black & Blue Stripe Shirt,"[""https://res.cloudinary.com/dt6wmon6z/image/upload/v1763398523/10186_meo1cm.jpg""]"
10378,Men,Apparel,Topwear,Tshirts,Black,Fall,2011,Casual,United Colors of Benetton Men Printed Black Tshirts,"[""https://res.cloudinary.com/dt6wmon6z/image/upload/v1763401069/10378_rcsrl4.jpg""]"
10181,Women,Accessories,Watches,Watches,Black,Winter,2016,Casual,Puma Women Pliancy Black Watches,"[""https://res.cloudinary.com/dt6wmon6z/image/upload/v1763398513/10181_guy3cz.jpg""]"
10347,Men,Apparel,Topwear,Tshirts,Purple,Fall,2011,Casual,United Colors of Benetton Men Printed Purple Tshirts,"[""https://res.cloudinary.com/dt6wmon6z/image/upload/v1763727513/10347_kxhdwn.jpg""]"
10175,Men,Footwear,Shoes,Casual Shoes,Black,Fall,2011,Casual,United Colors of Benetton Men Wango Black Casual Shoes,"[""https://res.cloudinary.com/dt6wmon6z/image/upload/v1763398447/10175_fywngt.jpg""]"
10511,Women,Apparel,Topwear,Tops,Black,Fall,2011,Casual,Flying Machine Women RN Black Tshirts,"[""https://res.cloudinary.com/dt6wmon6z/image/upload/v1763729931/10511_j5glhw.jpg""]"
10723,Men,Apparel,Topwear,Tshirts,White,Summer,2012,Sports,Nike Men Trainng Men's tshirt White Tshirts,"[""https://res.cloudinary.com/dt6wmon6z/image/upload/v1763734219/10723_mlx1ib.jpg""]"
10783,Men,Footwear,Shoes,Sports Shoes,White,Fall,2011,Sports,New Balance M364 Men Others Xtraining White Sports Shoes,"[""https://res.cloudinary.com/dt6wmon6z/image/upload/v1763734120/10783_gpiyy2.jpg""]"
10313,Women,Accessories,Watches,Watches,Steel,Winter,2016,Casual,Esprit Women Cool Chic White Steel Watches,"[""https://res.cloudinary.com/dt6wmon6z/image/upload/v1763727516/10313_iel4j5.jpg""]"
10777,Women,Apparel,Topwear,Jackets,Purple,Summer,2011,Sports,Nike Women Hooded Purple Jacket,"[""https://res.cloudinary.com/dt6wmon6z/image/upload/v1763734118/10777_tziat6.jpg""]"
10748,Unisex,Footwear,Flip Flops,Flip Flops,Navy Blue,Winter,2012,Kids,Disney Unisex Kids Basic Navy Blue Flip Flops,"[""https://res.cloudinary.com/dt6wmon6z/image/upload/v1763734078/10748_os1v32.jpg""]"
10770,Girls,Footwear,Shoes,Casual Shoes,Red,Winter,2012,Kids,Disney Kids Red Casual Shoes,"[""https://res.cloudinary.com/dt6wmon6z/image/upload/v1763734108/10770_juffze.jpg""]"
10314,Women,Accessories,Watches,Watches,Steel,Winter,2016,Casual,Esprit Women E-Ffect Black With White Dial Steel Watch,"[""https://res.cloudinary.com/dt6wmon6z/image/upload/v1763727516/10314_cfqzjh.jpg""]"
10126,Men,Footwear,Shoes,Sports Shoes,White,Fall,2011,Sports,Reebok Men Runtone Action White Sports Shoes,"[""https://res.cloudinary.com/dt6wmon6z/image/upload/v1763412875/10126_ifqfyd.jpg""]"
11000,Men,Accessories,Watches,Watches,Black,Winter,2016,Casual,Puma Men Slick 3HD Yellow Black Watches,"[""https://res.cloudinary.com/dt6wmon6z/image/upload/v1763737579/11000_lqbjfb.jpg""]"
10784,Unisex,Accessories,Headwear,Caps,Black,Fall,2011,Sports,Nike Unisex Runng Black Caps,"[""https://res.cloudinary.com/dt6wmon6z/image/upload/v1763734122/10784_mopqss.jpg""]"
10322,Women,Accessories,Bags,Handbags,Black,Winter,2015,Casual,Murcia Women Lambretta Black Green Handbags,"[""https://res.cloudinary.com/dt6wmon6z/image/upload/v1763727509/10322_kpg1wk.jpg""]"
10110,Women,Footwear,Shoes,Sports Shoes,White,Fall,2011,Sports,Reebok Women Instant White Sports Shoes,"[""https://res.cloudinary.com/dt6wmon6z/image/upload/v1763507897/10110_cikydo.jpg""]"
10574,Men,Apparel,Topwear,Tshirts,Navy Blue,Fall,2011,Casual,Puma Men Bts Navy Blue Tshirts,"[""https://res.cloudinary.com/dt6wmon6z/image/upload/v1763729875/10574_m5bgeu.jpg""]"
10746,Unisex,Footwear,Flip Flops,Flip Flops,Purple,Winter,2012,Kids,Disney Unisex Kids Princess Heart Purple Flip Flops,"[""https://res.cloudinary.com/dt6wmon6z/image/upload/v1763734075/10746_lduhjb.jpg""]"
10580,Men,Accessories,Watches,Watches,Copper,Winter,2016,Casual,Esprit Men Athletic Rosegold Copper Watches,"[""https://res.cloudinary.com/dt6wmon6z/image/upload/v1763729883/10580_ugbhqs.jpg""]"
10587,Men,Accessories,Watches,Watches,White,Winter,2016,Casual,Carrera Men Careera dial steel strap patch White Watches,"[""https://res.cloudinary.com/dt6wmon6z/image/upload/v1763729894/10587_zxyltb.jpg""]"
10741,Unisex,Footwear,Flip Flops,Flip Flops,Yellow,Winter,2012,Kids,Disney Unisex Kids Mickey Mouse Yellow Flip Flops,"[""https://res.cloudinary.com/dt6wmon6z/image/upload/v1763734071/10741_zwe2ip.jpg""]"
10573,Men,Apparel,Topwear,Tshirts,Navy Blue,Fall,2011,Casual,Puma Men Heritage Navy Blue Polo Tshirts,"[""https://res.cloudinary.com/dt6wmon6z/image/upload/v1763729875/10573_lwntel.jpg""]"
10117,Men,Footwear,Shoes,Sports Shoes,Silver,Fall,2011,Sports,Reebok Men Premier Zigfly Silver Sports Shoes,"[""https://res.cloudinary.com/dt6wmon6z/image/upload/v1763412875/10117_cmwjif.jpg""]"
10325,Men,Accessories,Watches,Watches,Black,Winter,2016,Casual,Puma Men Atlantis Black Watches,"[""https://res.cloudinary.com/dt6wmon6z/image/upload/v1763727510/10325_loeyww.jpg""]"
10128,Men,Footwear,Shoes,Formal Shoes,Black,Fall,2011,Formal,Rockport Men Drsp Wingtip Black Formal Shoes,"[""https://res.cloudinary.com/dt6wmon6z/image/upload/v1763412876/10128_anqibv.jpg""]"
10338,Men,Apparel,Topwear,Tshirts,White,Fall,2011,Casual,United Colors of Benetton Men Solid Polo White Tshirts,"[""https://res.cloudinary.com/dt6wmon6z/image/upload/v1763727510/10338_a6tecf.jpg""]"
10797,Men,Apparel,Topwear,Shirts,White,Fall,2011,Casual,Wrangler Men Urban Big Check White Shirts,"[""https://res.cloudinary.com/dt6wmon6z/image/upload/v1763734143/10797_grextb.jpg""]"
10307,Women,Footwear,Shoes,Flats,Silver,Fall,2011,Casual,Clarks Women Arizona Metallic Leather Silver Ballerinas,"[""https://res.cloudinary.com/dt6wmon6z/image/upload/v1763727515/10307_cyxg01.jpg""]"
10135,Women,Accessories,Watches,Watches,Silver,Winter,2016,Casual,Esprit Women Lissomy Glam White Silver Watches,"[""https://res.cloudinary.com/dt6wmon6z/image/upload/v1763412877/10135_n1wqrb.jpg""]"
10763,Men,Apparel,Topwear,Tshirts,Blue,Summer,2012,Sports,Nike Men Trainng Blue T-shirt,"[""https://res.cloudinary.com/dt6wmon6z/image/upload/v1763734098/10763_crx0tm.jpg""]"
10569,Women,Apparel,Topwear,Tops,White,Fall,2011,Casual,Puma Women Ess White Polo Tshirts,"[""https://res.cloudinary.com/dt6wmon6z/image/upload/v1763729868/10569_bjm3n0.jpg""]"
10764,Men,Apparel,Topwear,Tshirts,Black,Fall,2011,Casual,Puma Men Bts Black Tshirts,"[""https://res.cloudinary.com/dt6wmon6z/image/upload/v1763734099/10764_su7wok.jpg""]"
10300,Men,Footwear,Sandal,Sandals,Brown,Summer,2016,Casual,Clarks Men Brown Wild Vibe Leather Closed Sandals,"[""https://res.cloudinary.com/dt6wmon6z/image/upload/v1763400063/10300_boyvci.jpg""]"
10790,Men,Apparel,Topwear,Shirts,Blue,Fall,2011,Casual,Wrangler Men Manitoba Piping Blue Shirts,"[""https://res.cloudinary.com/dt6wmon6z/image/upload/v1763734131/10790_tbgdry.jpg""]"
10309,Women,Footwear,Shoes,Flats,White,Winter,2013,Casual,Clarks Women White Leather Flats,"[""https://res.cloudinary.com/dt6wmon6z/image/upload/v1763727515/10309_ebiuwl.jpg""]"
10799,Men,Apparel,Topwear,Shirts,Navy Blue,Fall,2011,Casual,Wrangler Men Wander Wheels Navy Blue Shirts,"[""https://res.cloudinary.com/dt6wmon6z/image/upload/v1763734143/10799_tvtnx1.jpg""]"
10104,Men,Footwear,Shoes,Sports Shoes,Black,Fall,2011,Sports,Reebok Men Buckets VI Black Sports Shoes,"[""https://res.cloudinary.com/dt6wmon6z/image/upload/v1763412873/10104_jqhhqn.jpg""]"
10336,Women,Apparel,Topwear,Tops,Black,Fall,2011,Casual,United Colors of Benetton Women Stripes Black Tops,"[""https://res.cloudinary.com/dt6wmon6z/image/upload/v1763727511/10336_cq2fqq.jpg""]"
10752,Men,Apparel,Topwear,Tshirts,White,Fall,2011,Sports,Nike Men Hell With White Tshirts,"[""https://res.cloudinary.com/dt6wmon6z/image/upload/v1763734083/10752_jxcgvu.jpg""]"
10594,Women,Accessories,Watches,Watches,Pink,Winter,2016,Casual,Esprit Women Houston Funky Pink Pink Watches,"[""https://res.cloudinary.com/dt6wmon6z/image/upload/v1763729896/10594_nm6zmw.jpg""]"
10593,Women,Accessories,Watches,Watches,Purple,Winter,2016,Casual,Esprit Women Houston Purple Ice Purple Watches,"[""https://res.cloudinary.com/dt6wmon6z/image/upload/v1763729895/10593_dlh4ve.jpg""]"
10567,Women,Apparel,Topwear,Tshirts,Pink,Fall,2011,Casual,Puma Women Striped Polo Pink Tshirts,"[""https://res.cloudinary.com/dt6wmon6z/image/upload/v1763729868/10567_esdop3.jpg""]"
10755,Girls,Footwear,Shoes,Casual Shoes,Pink,Winter,2012,Kids,Disney Kids Princess Heart Pink Casual Shoes,"[""https://res.cloudinary.com/dt6wmon6z/image/upload/v1763734087/10755_gdbx6f.jpg""]"
10331,Men,Accessories,Belts,Belts,Black,Fall,2011,Casual,Indigo Nation Men basalt Black Belts,"[""https://res.cloudinary.com/dt6wmon6z/image/upload/v1763727512/10331_ptqdtj.jpg""]"
10391,Men,Accessories,Watches,Watches,Black,Winter,2016,Casual,Puma Men Drift 244 Black Watches,"[""https://res.cloudinary.com/dt6wmon6z/image/upload/v1763401090/10391_tobya1.jpg""]"
10701,Women,Accessories,Watches,Watches,Steel,Winter,2016,Casual,Esprit Women Silver Houston Steel Watches,"[""https://res.cloudinary.com/dt6wmon6z/image/upload/v1763732568/10701_daa8df.jpg""]"
10533,Men,Footwear,Shoes,Sports Shoes,Black,Fall,2011,Sports,New Balance MW631 Men Others Walking Black Sports Shoes,"[""https://res.cloudinary.com/dt6wmon6z/image/upload/v1763729856/10533_gicsyj.jpg""]"
10157,Unisex,Footwear,Flip Flops,Flip Flops,Blue,Fall,2011,Casual,Puma Unisex Puma Flips Blue Flip Flops,"[""https://m.media-amazon.com/images/I/61K4mZ9W0tL._AC_SY500_.jpg""]"
10365,Women,Apparel,Dress,Dresses,Black,Fall,2011,Casual,United Colors of Benetton Women Short Black Dresses,"[""https://res.cloudinary.com/dt6wmon6z/image/upload/v1763401051/10365_lzy5ju.jpg""]"
10168,Men,Footwear,Shoes,Casual Shoes,Black,Fall,2011,Casual,United Colors of Benetton Men Punk Black Casual Shoes,"[""https://res.cloudinary.com/dt6wmon6z/image/upload/v1763398439/10168_noup7b.jpg""]"
10362,Women,Apparel,Topwear,Tshirts,Purple,Fall,2011,Casual,United Colors of Benetton Women Purple Polo T-shirt,"[""https://res.cloudinary.com/dt6wmon6z/image/upload/v1763401049/10362_s9psgt.jpg""]"
10150,Men,Footwear,Shoes,Formal Shoes,Black,Fall,2011,Formal,Rockport Men Drsp Plaintoe Black Formal Shoes,"[""https://res.cloudinary.com/dt6wmon6z/image/upload/v1763507899/10150_longpr.jpg""]"
10706,Women,Accessories,Watches,Watches,Gold,Winter,2016,Casual,Esprit Women Lissomy Two Tone Gold Watches,"[""https://res.cloudinary.com/dt6wmon6z/image/upload/v1763732574/10706_qqlmfx.jpg""]"
10396,Men,Accessories,Watches,Watches,Black,Winter,2016,Sports,Puma Men Atlantis All Black Watches,"[""https://res.cloudinary.com/dt6wmon6z/image/upload/v1763401098/10396_szncsf.jpg""]"
10998,Men,Accessories,Watches,Watches,Black,Winter,2016,Sports,Puma Men Blockbuster Red Black Watches,"[""https://res.cloudinary.com/dt6wmon6z/image/upload/v1763737574/10998_ptw3ko.jpg""]"
10739,Unisex,Footwear,Flip Flops,Flip Flops,Black,Winter,2012,Kids,Disney Unisex Kids Basic Black Flip Flops,"[""https://res.cloudinary.com/dt6wmon6z/image/upload/v1763734066/10739_hazce0.jpg""]"
10502,Women,Apparel,Topwear,Tshirts,Blue,Fall,2011,Casual,Flying Machine Women Ocean Blue Tshirts,"[""https://res.cloudinary.com/dt6wmon6z/image/upload/v1763729917/10502_wyt7zx.jpg""]"
10730,Women,Accessories,Bags,Handbags,Grey,Winter,2015,Casual,Murcia Women Lorra Grey Grey Handbags,"[""https://res.cloudinary.com/dt6wmon6z/image/upload/v1763734057/10730_qzigmq.jpg""]"
10354,Women,Apparel,Topwear,Tops,Blue,Fall,2011,Casual,United Colors of Benetton Women Checks Blue Tops,"[""https://res.cloudinary.com/dt6wmon6z/image/upload/v1763401141/10354_xc1pbx.jpg""]"
10166,Men,Footwear,Flip Flops,Flip Flops,Red,Fall,2011,Casual,United Colors of Benetton Men Carribean Red Flip Flops,"[""https://m.media-amazon.com/images/I/71AjzfQZLyL._AC_SY500_.jpg""]"
10192,Men,Accessories,Watches,Watches,Steel,Winter,2016,Casual,Esprit Men Avalance Black Steel Watches,"[""https://res.cloudinary.com/dt6wmon6z/image/upload/v1763398542/10192_kvclmk.jpg""]"
10159,Men,Footwear,Shoes,Casual Shoes,White,Fall,2011,Casual,Puma Men 917 Mid Spill White Casual Shoes,"[""https://res.cloudinary.com/dt6wmon6z/image/upload/v1763398428/10159_kdxdrv.jpg""]"
10991,Men,Apparel,Topwear,Tshirts,Brown,Fall,2011,Casual,Inkfruit Men Havy Metal Brown Tshirts,"[""https://res.cloudinary.com/dt6wmon6z/image/upload/v1763737563/10991_vpoxtg.jpg""]"
10195,Men,Accessories,Watches,Watches,Blue,Winter,2016,Formal,Carrera Men Steel strap dial Blue Watches,"[""https://res.cloudinary.com/dt6wmon6z/image/upload/v1763398548/10195_tg94oo.jpg""]"
10161,Men,Footwear,Shoes,Sports Shoes,White,Fall,2011,Sports,Puma Men Cabana Racer White Sports Shoes,"[""https://res.cloudinary.com/dt6wmon6z/image/upload/v1763398434/10161_ye73c7.jpg""]"
10737,Women,Accessories,Bags,Handbags,Black,Winter,2015,Casual,Murcia Women Hmzaab Black Handbags,"[""https://res.cloudinary.com/dt6wmon6z/image/upload/v1763734065/10737_jmz7ga.jpg""]"
10505,Women,Apparel,Topwear,Tshirts,Yellow,Fall,2011,Casual,Flying Machine Women RN HS Yellow Tshirts,"[""https://res.cloudinary.com/dt6wmon6z/image/upload/v1763729922/10505_imgt9h.jpg""]"
10398,Men,Accessories,Watches,Watches,Black,Winter,2016,Sports,Puma Men Cardiac II Black Watches,"[""https://res.cloudinary.com/dt6wmon6z/image/upload/v1763401103/10398_nzqfey.jpg""]"
10996,Men,Apparel,Topwear,Tshirts,Brown,Fall,2011,Casual,Inkfruit Men Too Drunk Brown Tshirts,"[""https://res.cloudinary.com/dt6wmon6z/image/upload/v1763737573/10996_n7c7ec.jpg""]"
10708,Men,Apparel,Topwear,Tshirts,Black,Fall,2011,Casual,Nike Men Logo T-shirt Black Tshirts,"[""https://res.cloudinary.com/dt6wmon6z/image/upload/v1763732575/10708_qf7eju.jpg""]"
10754,Unisex,Footwear,Flip Flops,Flip Flops,Blue,Winter,2012,Kids,Disney Unisex Kids Mickey Star Blue Flip Flops,"[""https://res.cloudinary.com/dt6wmon6z/image/upload/v1763734085/10754_zpbhnl.jpg""]"
10566,Men,Apparel,Topwear,Tshirts,Grey,Fall,2011,Casual,Puma Men Rugby Grey Tshirts,"[""https://res.cloudinary.com/dt6wmon6z/image/upload/v1763729857/10566_ixu6qj.jpg""]"
10102,Men,Footwear,Shoes,Sports Shoes,Black,Fall,2011,Sports,Reebok Men Premier Verona Supreme 2 Black Sports Shoes,"[""https://res.cloudinary.com/dt6wmon6z/image/upload/v1763412872/10102_nbvk7p.jpg""]"
10330,Men,Accessories,Belts,Belts,Black,Fall,2011,Casual,Indigo Nation Men Alnoite Black Belts,"[""https://res.cloudinary.com/dt6wmon6z/image/upload/v1763727512/10330_fta62p.jpg""]"
10308,Men,Footwear,Shoes,Casual Shoes,Brown,Fall,2012,Casual,Clarks Men Brown Leather Boat Shoes,"[""https://res.cloudinary.com/dt6wmon6z/image/upload/v1763727515/10308_c81ymt.jpg""]"
10595,Women,Free Items,Free Gifts,Free Gifts,Grey,Winter,2016,Casual,Esprit Women Cascade Grey Dial Watch,"[""https://res.cloudinary.com/dt6wmon6z/image/upload/v1763729896/10595_tvildf.jpg""]"
10105,Women,Accessories,Watches,Watches,Steel,Winter,2016,Casual,Fastrack Women Analogue Leather Steel Watches,"[""https://res.cloudinary.com/dt6wmon6z/image/upload/v1763412872/10105_tscuzx.jpg""]"
10753,Unisex,Footwear,Flip Flops,Flip Flops,Navy Blue,Winter,2012,Kids,Disney Unisex Kids Basic Navy Blue Flip Flops,"[""https://res.cloudinary.com/dt6wmon6z/image/upload/v1763734084/10753_pussj2.jpg""]"
10568,Men,Apparel,Topwear,Sweaters,Navy Blue,Fall,2011,Casual,Puma Men Knitted Navy Blue Sweater,"[""https://res.cloudinary.com/dt6wmon6z/image/upload/v1763729868/10568_gzgrgr.jpg""]"
10791,Men,Apparel,Topwear,Shirts,Black,Fall,2011,Casual,Wrangler Men Manitoba Piping Black Shirts,"[""https://res.cloudinary.com/dt6wmon6z/image/upload/v1763734132/10791_zsnwjo.jpg""]"
10765,Unisex,Footwear,Flip Flops,Flip Flops,Navy Blue,Winter,2012,Kids,Disney Unisex Kids Basic Navy Blue Flip Flops,"[""https://res.cloudinary.com/dt6wmon6z/image/upload/v1763734099/10765_hvtsfj.jpg""]"
10301,Men,Footwear,Shoes,Casual Shoes,Brown,Fall,2011,Casual,Clarks Brown Leather Casual Shoes,"[""https://res.cloudinary.com/dt6wmon6z/image/upload/v1763727514/10301_oa5ifi.jpg""]"
10133,Women,Accessories,Watches,Watches,Silver,Winter,2016,Casual,Esprit Women Rough Chic Black Silver Watches,"[""https://res.cloudinary.com/dt6wmon6z/image/upload/v1763507902/10133_w6vexz.jpg""]"
10339,Women,Apparel,Topwear,Tshirts,Black,Fall,2011,Casual,United Colors of Benetton Women Black Polo T-shirt,"[""https://res.cloudinary.com/dt6wmon6z/image/upload/v1763727510/10339_fqqlbh.jpg""]"
10134,Women,Accessories,Watches,Watches,Silver,Winter,2016,Casual,Esprit Women Lissomy Glam Black Silver Watches,"[""https://res.cloudinary.com/dt6wmon6z/image/upload/v1763507902/10134_mgkm1u.jpg""]"
10306,Men,Footwear,Shoes,Casual Shoes,Grey,Fall,2011,Casual,Clarks Men Rocco Fuse Leather Grey Casual Shoes,"[""https://res.cloudinary.com/dt6wmon6z/image/upload/v1763727515/10306_fstngr.jpg""]"
10762,Unisex,Footwear,Flip Flops,Flip Flops,Yellow,Winter,2012,Kids,Disney Unisex Kids Basic Yellow Flip Flops,"[""https://res.cloudinary.com/dt6wmon6z/image/upload/v1763734098/10762_bwtn5d.jpg""]"
10796,Men,Apparel,Topwear,Shirts,Red,Fall,2011,Casual,Wrangler Men Warnick Square Block Red Shirts,"[""https://res.cloudinary.com/dt6wmon6z/image/upload/v1763734138/10796_mpgxmn.jpg""]"
10352,Men,Apparel,Topwear,Shirts,White,Fall,2011,Casual,United Colors of Benetton Men Solid White Shirts,"[""https://res.cloudinary.com/dt6wmon6z/image/upload/v1763401137/10352_t1nizt.jpg""]"
10160,Men,Footwear,Shoes,Casual Shoes,White,Fall,2011,Casual,Puma Men 917 Lo Paint Splatter White Casual Shoes,"[""https://res.cloudinary.com/dt6wmon6z/image/upload/v1763398434/10160_ybtqy9.jpg""]"
10504,Women,Apparel,Topwear,Tshirts,White,Fall,2011,Casual,Flying Machine Women RN HS White Tshirts,"[""https://res.cloudinary.com/dt6wmon6z/image/upload/v1763729922/10504_jx3nid.jpg""]"
10736,Women,Accessories,Bags,Handbags,Red,Winter,2015,Casual,Murcia Women Mcc Red Red Handbags,"[""https://res.cloudinary.com/dt6wmon6z/image/upload/v1763734066/10736_ruzoo2.jpg""]"
10194,Men,Accessories,Watches,Watches,Black,Winter,2016,Casual,Carrera Men Sqaure dial leather strap Black Watches,"[""https://res.cloudinary.com/dt6wmon6z/image/upload/v1763398544/10194_t6xili.jpg""]"
10709,Women,Apparel,Topwear,Tshirts,Purple,Fall,2011,Sports,Nike Women Trainng short sleeve tshirt Purple Tshirts,"[""https://res.cloudinary.com/dt6wmon6z/image/upload/v1763732577/10709_fb7l4c.jpg""]"
10997,Men,Accessories,Watches,Watches,Silver,Winter,2016,Casual,Puma Men Track White Silver Watches,"[""https://res.cloudinary.com/dt6wmon6z/image/upload/v1763737574/10997_pr1ed7.jpg""]"
10399,Men,Accessories,Watches,Watches,Black,Winter,2016,Casual,Puma Men Cardiac 209 Black Watches,"[""https://res.cloudinary.com/dt6wmon6z/image/upload/v1763401103/10399_wyohe8.jpg""]"
10193,Men,Accessories,Watches,Watches,Black,Winter,2016,Casual,Carrera Men Dial Green Numbers Black Watch,"[""https://res.cloudinary.com/dt6wmon6z/image/upload/v1763398543/10193_krjrno.jpg""]"
10731,Women,Accessories,Bags,Handbags,Brown,Winter,2015,Casual,Murcia Women Lorra Coffee Brown Handbags,"[""https://res.cloudinary.com/dt6wmon6z/image/upload/v1763734058/10731_omyzdx.jpg""]"
10503,Women,Apparel,Topwear,Tshirts,White,Fall,2011,Casual,Flying Machine Women RN HS White Tshirts,"[""https://res.cloudinary.com/dt6wmon6z/image/upload/v1763729917/10503_zrwywf.jpg""]"
10167,Men,Footwear,Shoes,Casual Shoes,Black,Fall,2011,Casual,United Colors of Benetton Men Nighthawk Black Casual Shoes,"[""https://res.cloudinary.com/dt6wmon6z/image/upload/v1763398438/10167_bt2lmb.jpg""]"
10355,Men,Apparel,Topwear,Shirts,Blue,Fall,2011,Formal,United Colors of Benetton Men Stripes Blue Shirts,"[""https://res.cloudinary.com/dt6wmon6z/image/upload/v1763401142/10355_m5ar5i.jpg""]"
10990,Women,Apparel,Topwear,Tshirts,Pink,Fall,2011,Casual,Inkfruit Women Irritating Pink Tshirts,"[""https://res.cloudinary.com/dt6wmon6z/image/upload/v1763737563/10990_ajxwro.jpg""]"
10158,Men,Footwear,Shoes,Casual Shoes,Black,Fall,2011,Casual,Puma Men 917 Lo Feuer Black Casual Shoes,"[""https://res.cloudinary.com/dt6wmon6z/image/upload/v1763398429/10158_ddq15o.jpg""]"
10999,Men,Accessories,Watches,Watches,Black,Winter,2016,Casual,Puma Men Rod Yellow Black Watches,"[""https://res.cloudinary.com/dt6wmon6z/image/upload/v1763737579/10999_avk5sx.jpg""]"
10397,Men,Accessories,Watches,Watches,Black,Winter,2016,Casual,Puma Men Slick Gents 3 Black Watches,"[""https://res.cloudinary.com/dt6wmon6z/image/upload/v1763401102/10397_jucyrm.jpg""]"
10151,Men,Footwear,Shoes,Formal Shoes,Black,Fall,2011,Formal,Rockport Men Drsp Slip On Black Formal Shoes,"[""https://res.cloudinary.com/dt6wmon6z/image/upload/v1763398427/10151_iap584.jpg""]"
10363,Women,Apparel,Topwear,Tops,Grey,Fall,2011,Casual,United Colors of Benetton Women Solid Grey Tops,"[""https://res.cloudinary.com/dt6wmon6z/image/upload/v1763401050/10363_lmdfp8.jpg""]"
10707,Women,Accessories,Watches,Watches,Gold,Winter,2016,Casual,Esprit Women Open Link Gold Gold Watch,"[""https://res.cloudinary.com/dt6wmon6z/image/upload/v1763732576/10707_daa1dr.jpg""]"
10738,Women,Accessories,Watches,Watches,Pink,Winter,2016,Casual,Puma Women Slick Ladies 3HD Pink Pink Watches,"[""https://res.cloudinary.com/dt6wmon6z/image/upload/v1763734065/10738_dolv1g.jpg""]"
10700,Women,Accessories,Watches,Watches,Steel,Winter,2016,Casual,Esprit Women Pure Black Glam Rock Houston Steel Watches,"[""https://res.cloudinary.com/dt6wmon6z/image/upload/v1763732568/10700_jayghk.jpg""]"
10364,Men,Apparel,Topwear,Tshirts,Magenta,Fall,2011,Casual,United Colors of Benetton Men Solid Magenta T-shirt,"[""https://res.cloudinary.com/dt6wmon6z/image/upload/v1763401050/10364_khrgve.jpg""]"
10156,Men,Footwear,Shoes,Casual Shoes,Brown,Fall,2011,Casual,Rockport Men Sc Slip On Brown Casual Shoes,"[""https://res.cloudinary.com/dt6wmon6z/image/upload/v1763398427/10156_cdzgu5.jpg""]"
10390,Women,Accessories,Watches,Watches,White,Winter,2016,Casual,Puma Women Finesse 233 White Watches,"[""https://res.cloudinary.com/dt6wmon6z/image/upload/v1763401089/10390_pgdhhb.jpg""]"
10169,Men,Footwear,Shoes,Casual Shoes,Brown,Fall,2011,Casual,United Colors of Benetton Men HIghlander Brown Casual Shoes,"[""https://res.cloudinary.com/dt6wmon6z/image/upload/v1763398439/10169_pzfgjg.jpg""]"
10827,Men,Apparel,Topwear,Tshirts,White,Fall,2011,Casual,Wrangler Men White Celebrate Indigo T-shirt,"[""https://res.cloudinary.com/dt6wmon6z/image/upload/v1763734185/10827_d5aazu.jpg""]"
10229,Women,Accessories,Bags,Handbags,Black,Winter,2015,Casual,Murcia Women Hths Black Handbags,"[""https://res.cloudinary.com/dt6wmon6z/image/upload/v1763475582/10229_voihfy.jpg""]"
10216,Women,Accessories,Bags,Handbags,Green,Winter,2015,Casual,Murcia Women Hths Green Handbags,"[""https://res.cloudinary.com/dt6wmon6z/image/upload/v1763475453/10216_kmog6w.jpg""]"
10024,Women,Apparel,Topwear,Tshirts,Black,Fall,2011,Sports,Nike Women As Make Yours Black T-Shirts,"[""https://res.cloudinary.com/dt6wmon6z/image/upload/v1763392677/10024_rm0cva.jpg""]"
10818,Men,Apparel,Topwear,Shirts,Red,Fall,2011,Casual,Wrangler Men Urban Raiser Red Shirts,"[""https://res.cloudinary.com/dt6wmon6z/image/upload/v1763734172/10818_msexsg.jpg""]"
